Title,Text
of perfect beauty and the brother of poetry—the bland, grave, competent, and patrician
cat."
The Despised PastoralBy H. P. Lovecraft by By H. P. Lovecraft,"Among the many and complex tendencies observable in modern poetry, or what answers for poetry
in this age, is a decided but unjust scorn of the honest old pastoral, immortalised by Theocritus
and Virgil, and revived in our own literature by Spenser.Nor is this unfavourable attitude confined alone to the formal eclogue whose
classical elements are so well described and exemplified by Mr. Pope. Whenever a versifier adorns
his song with the pleasing and innocent imagery of this type of composition, or borrows its
mild and sweet atmosphere, he is forthwith condemned as an irresponsible pedant and fossil by
every little-wit critic in Grub-Street.Modern bards, in their endeavour to display with seriousness and minute verisimilitude
the inward operations of the human mind and emotions, have come to look down upon the simple
description of ideal beauty, or the straightforward presentation of pleasing images for no other
purpose than to delight the fancy. Such themes they deem trivial and artificial, and altogether
unworthy of an art whose design they take to be the analysis and reproduction of Nature in all
her moods and aspects.But in this belief, the writer cannot but hold that our contemporaries are
misjudging the true province and functions of poesy. It was no starched classicist, but the
exceedingly unconventional Edgar Allan Poe, who roundly denounced the melancholy metaphysicians
and maintained that true poetry has for its first object “pleasure, not truth”,
and “indefinite pleasure instead of definite pleasure”. Mr. Poe, in another essay,
defined poetry as “the rhythmical creation of beauty”, intimating that its concern
for the dull or ugly aspects of life is slight indeed. That the American bard and critic was
fundamentally just in his deductions, seems well proved by a comparative survey of those poems
of all ages which have lived, and those which have fallen into deserved obscurity.The English pastoral, based upon the best models of antiquity, depicts engaging
scenes of Arcadian simplicity, which not only transport the imagination through their intrinsic
beauty, but recall to the scholarly mind the choicest remembrances of classical Greece and Rome.
Though the combination of rural pursuits with polished sentiments and diction is patently artificial,
the beauty is not a whit less; nor do the conventional names, phrases, and images detract in
the least from the quaint agreeableness of the whole. The magic of this sort of verse is to
any unprejudiced mind irresistible, and is capable of evoking a more deliciously placid and
refreshing train of pictures in the imagination, than may be obtained from any more realistic
species of composition. Every untainted fancy begets ideal visions of which the pastoral forms
a legitimate and artistically necessary reflection.It is not impossible that the intellectual upheaval attendant upon the present
conflict will bring about a general simplification and rectification of taste, and an appreciation
of the value of pure imaginary beauty in a world so full of actual misery, which may combine
to restore the despised pastoral to its proper station."
Literary CompositionBy H. P. Lovecraft by By H. P. Lovecraft,"In a former article our readers have been shewn the fundamental sources of literary inspiration,
   and the leading prerequisites to expression. It remains to furnish hints concerning expression
   itself—its forms, customs, and technicalities—in order that the young writer may
   lose nothing of force or charm in presenting his ideas to the public.GrammarA review of the elements of English grammar would be foreign to the purpose of
   this department. The subject is one taught in all common schools, and may be presumed to be
   understood by every aspirant to authorship. It is necessary, however, to caution the beginner to
   keep a reliable grammar and dictionary always beside him, that he may avoid in his compositions
   the frequent errors which imperceptibly corrupt even the purest ordinary speech. As a general
   rule, it is well to give close critical scrutiny to all colloquial phrases and expressions of
   doubtful parsing, as well as to all words and usages which have a strained or unfamiliar sound.
   The human memory is not to be trusted too far, and most minds harbour a considerable number of
   slight linguistic faults and inelegancies picked up from random discourse or from the pages of
   newspapers, magazines, and popular modern books.Types of MistakesMost of the mistakes of young authors, aside from those gross violations of syntax
   which ordinary education corrects, may perhaps be enumerated as follows.(1)Erroneous plurals of nouns, asvalliesorechos.(2)Barbarous compound nouns, asviewpointorupkeep.(3)Want of correspondence in number between noun and verb
         where the two are widely separated or the construction involved.(4)Ambiguous use of pronouns.(5)Erroneous case of pronouns, aswhomforwho,and vice versa, or phrases like “between you andI”, or “Letwewho are loyal, act promptly.”(6)Erroneous use ofshallandwill,and of other
         auxiliary verbs.(7)Use of intransitive for transitive verbs, as “hewas graduatedfrom college”, or vice versa, as “heingratiatedwith the tyrant”.(8)Use of nouns for verbs, as “hemotoredto
         Boston”, or “hevoiceda protest”.(9)Errors in moods and tenses of verbs, as “If Iwashe, I should do otherwise”, or “He said the earthwasround.”(10)The split infinitive, as “tocalmlyglide”.(11)The erroneous perfect infinitive, as “Last week I
         expectedto have metyou.”(12)False verb-forms, as “Ipledwith
         him.”(13)Use oflikeforas,as “I strive to
         writelikePope wrote.”(14)Misuse of prepositions, as “The gift was bestowedtoan unworthy object”, or “The gold was dividedbetweenthe
         five men.”(15)The superfluous conjunction, as “I wishforyou to do this.”(16)Use of words in wrong senses, as “The book greatlyintriguedme”, “Leaveme take this”, “He wasobsessedwith the idea”, or “He is ameticulouswriter.”(17)Erroneous use of non-Anglicised foreign forms, as “a
         strangephenomena”, or “twostratasof
         clouds”.(18)Use of false or unauthorised words, asburglariseorsupremest.(19)Errors of taste, including vulgarisms, pompousness,
         repetition, vagueness, ambiguousness, colloquialism, bathos, bombast, pleonasm, tautology,
         harshness, mixed metaphor, and every sort of rhetorical
         awkwardness.(20)Errors of spelling and punctuation, and confusion of forms
         such as that which leads many to place an apostrophe in the possessive pronounits.Of all blunders, there is hardly one which might not be avoided through diligent
   study of simple textbooks on grammar and rhetoric, intelligent perusal of the best authors, and
   care and forethought in composition. Almost no excuse exists for their persistent occurrence,
   since the sources of correction are so numerous and so available. Many of the popular manuals of
   good English are extremely useful, especially to persons whose reading is not as yet extensive;
   but such works sometimes err in being too pedantically precise and formal. For correct writing,
   the cultivation of patience and mental accuracy is essential. Throughout the young
   author’s period of apprenticeship, he must keep reliable dictionaries and textbooks at his
   elbow; eschewing as far as possible that hasty extemporaneous manner of writing which is the
   privilege of more advanced students. He must take no popular usage for granted, nor must he ever
   hesitate, in case of doubt, to fall back on the authority of his books.ReadingNo aspiring author should content himself with a mere acquisition of technical
   rules. As Mrs. Renshaw remarked in the preceding article, “Impression should ever precede
   and be stronger than expression.” All attempts at gaining literary polish must begin with
   judiciousreading,and the learner must never cease to hold this phase uppermost. In many
   cases, the usage of good authors will be found a more effective guide than any amount of
   precept. A page of Addison or of Irving will teach more of style than a whole manual of rules,
   whilst a story of Poe’s will impress upon the mind a more vivid notion of powerful and
   correct description and narration than will ten dry chapters of a bulky text-book. Let every
   student read unceasingly the best writers, guided by the admirable Reading Table which has
   adorned theUnited Amateurduring the past two years.It is also important that cheaper types of reading, if hitherto followed, be
   dropped. Popular magazines inculcate a careless and deplorable style which is hard to unlearn,
   and which impedes the acquisition of a purer style. If such things must be read, let them be
   skimmed over as lightly as possible. An excellent habit to cultivate is the analytical study of
   the King James Bible. For simple yet rich and forceful English, this masterly production is hard
   to equal; and even though its Saxon vocabulary and poetic rhythm be unsuited to general
   composition, it is an invaluable model for writers on quaint or imaginative themes. Lord
   Dunsany, perhaps the greatest living prose artist, derived nearly all of his stylistic
   tendencies from the Scriptures; and the contemporary critic Boyd points out very acutely the
   loss sustained by most Catholic Irish writers through their unfamiliarity with the historic
   volume and its traditions.VocabularyOne superlatively important effect of wide reading is the enlargement of
   vocabulary which always accompanies it. The average student is gravely impeded by the narrow
   range of words from which he must choose, and he soon discovers that in long compositions he
   cannot avoid monotony. In reading, the novice should note the varied mode of expression
   practiced by good authors, and should keep in his mind for future use the many appropriate
   synonyms he encounters. Never should an unfamiliar word be passed over without elucidation; for
   with a little conscientious research we may each day add to our conquests in the realm of
   philology, and become more and more ready for graceful independent expression.But in enlarging the vocabulary, we must beware lest we misuse our new
   possessions. We must remember that there are fine distinctions betwixt apparently similar words,
   and that language must ever be selected with intelligent care. As the learned Dr. Blair points
   out in his Lectures, “Hardly in any language are there two words that convey precisely the
   same idea; a person thoroughly conversant in the propriety of language will always be able to
   observe something that distinguishes them.”Elemental PhasesBefore considering the various formal classes of composition, it is well to note
   certain elements common to them all. Upon analysis, every piece of writing will be found to
   contain one or more of the following basic principles:Description,or an account of the
   appearance of things;Narration,or an account of the actions of things;Exposition,which defines and explains with precision and lucidity;Argument,which discovers truth and rejects error; andPersuasion,which urges to certain thoughts
   or acts. The first two are the bases of fiction; the third didactic, scientific, historical, and
   editorial writings. The fourth and fifth are mostly employed in conjunction with the third, in
   scientific, philosophical, and partisan literature. All these principles, however, are usually
   mingled with one another. The work of fiction may have its scientific, historical, or
   argumentative side; whilst the text-book or treatise may be embellished with descriptions and
   anecdotes.DescriptionDescription, in order to be effective, calls upon two mental qualities:
   observation and discrimination. Many descriptions depend for their vividness upon the accurate
   reproduction of details; others upon the judicious selection of salient, typical, or significant
   points.One cannot be too careful in the selection of adjectives for descriptions. Words
   or compounds which describe precisely, and which convey exactly the right suggestions to the
   mind of the reader, are essential. As an example, let us consider the following list of epithets
   applicable to afountain,taken from Richard Green Parker’s admirable work on
   composition.Crystal, gushing, rustling, silver, gently-gliding, parting,
      pearly, weeping, bubbling, gurgling, chiding, clear, grass-fringed, moss-fringed,
      pebble-paved, verdant, sacred, grass-margined, moss-margined, trickling, soft, dew-sprinkled,
      fast-flowing, delicate, delicious, clean, straggling, dancing, vaulting, deep-embosomed,
      leaping, murmuring, muttering, whispering, prattling, twaddling, swelling, sweet-rolling,
      gently-flowing, rising, sparkling, flowing, frothy, dew-distilling, dew-born, exhaustless,
      inexhaustible, never-decreasing, never-falling, heaven-born, earth-born, deep-divulging,
      drought-dispelling, thirst-allaying, refreshing, soul-refreshing, earth-refreshing, laving,
      lavish, plant-nourishing.For the purpose of securing epithets at once accurate and felicitous, the young
   author should familiarise himself thoroughly with the general aspect and phenomena of Nature, as
   well as with the ideas and associations which these things produce in the human mind.Descriptions may be of objects, of places, of animals, and of persons. The
   complete description of an object may be said to consist of the following elements:When, where, and how seen; when made or found; how affected by time.History and traditional associations.Substance and manner of origin.Size, shape, and appearance.Analogies with similar objects.Sensations produced by contemplating it.Its purpose or function.Its effects—the results of its existence.Descriptions of places must of course vary with the type of the place. Of natural
   scenery, the following elements are notable:How beheld—at dawn, noon, evening, or night; by starlight or moonlight.Natural features—flat or hilly; barren or thickly grown; kind of vegetation; trees,
   mountains, and rivers.Works of man—cultivation, edifices, bridges, modifications of scenery produced by
   man.Inhabitants and other forms of animal life.Local customs and traditions.Sounds—of water; forest; leaves; birds; barnyards; human beings; machinery.View—prospect on every side, and the place itself as seen from afar.Analogies to other scenes, especially famous scenes.History and associations.Sensations produced by contemplating it.Descriptions of animals may be analyzed thus:Species and size.Covering.Parts.Abode.Characteristics and habits.Food.Utility or harmfulness.History and associations.Descriptions of persons can be infinitely varied. Sometimes a single felicitous
   touch brings out the whole type and character, as when the modern author Leonard Merrick hints
   at shabby gentility by mentioning the combination of a frock coat with the trousers of a tweed
   suit. Suggestion is very powerful in this field, especially when mental qualities are to be
   delineated. Treatment should vary with the author’s object; whether to portray a mere
   personified idea, or to give a quasi-photographic view, mental and physical, of some vividly
   living character. In a general description, the following elements may be found:Appearance, stature, complexion, proportions, features.Most conspicuous feature.Expression.Grace or ugliness.Attire—nature, taste, quality.Habits, attainments, graces, or awkwardnesses.Character—moral and intellectual; place in the community.Notable special qualities.In considering the preceding synopses, the reader must remember that they are only
   suggestions, and not forliteraluse. The extent of any description is to be determined
   by its place in the composition; by taste and fitness. It should be added, that in fiction
   description must not be carried to excess. A plethora of it leads to dulness, so that it must
   ever be balanced by a brisk flow ofNarration,which we are about to
   consider.NarrationNarration is an account of action, or of successive events, either real or
   imagined; and is therefore the basis both of history and of fiction. To be felicitous and
   successful, it demands an intelligent exercise of taste and discrimination; salient points must
   be selected, and the order of time and of circumstances must be well maintained. It is deemed
   wisest in most cases to give narratives a climactic form; leading from lesser to greater events,
   and culminating in that chief incident upon which the story is primarily founded, or which makes
   the other parts important through its own importance. This principle, of course, cannot be
   literally followed in all historical and biographical narratives.Fictional NarrationThe essential point of fictional narration isplot,which may be defined as
   asequence of incidents designed to awaken the reader’s interest and curiosity as to
   the result.Plots may be simple or complex; but suspense, and climactic progress from one
   incident to another, are essential. Every incident in a fictional work should have some bearing
   on the climax or denouement, and any denouement which is not the inevitable result of the
   preceding incidents is awkward and unliterary. No formal course in fiction-writing can equal a
   close and observant perusal of the stories of Edgar Allan Poe or Ambrose Bierce. In these
   masterpieces one may find that unbroken sequence and linkage of incident and result which mark
   the ideal tale. Observe how, in “The Fall of the House of Usher”, each separate
   event foreshadows and leads up to the tremendous catastrophe and its hideous suggestion. Poe was
   an absolute master of the mechanics of his craft. Observe also how Bierce can attain the most
   stirring denouements from a few simple happenings; denouements which develop purely from these
   preceding circumstances.In fictional narration, verisimilitude is absolutely essential. A story must be
   consistent and must contain no event glaringly removed from the usual order of things, unless
   that event is the main incident, and is approached with the most careful preparation. In real
   life, odd and erratic things do occasionally happen; but they are out of place in an ordinary
   story, since fiction is a sort of idealisation of the average. Development should be as
   life-like as possible, and a weak, trickling conclusion should be assiduously avoided. The end
   of a story must be stronger rather than weaker than the beginning; since it is the end which
   contains the denouement or culmination, and which will leave the strongest impression upon the
   reader. It would not be amiss for the novice to write the last paragraph of his story first,
   once a synopsis of the plot has been carefully prepared—as it always should be. In this
   way he will be able to concentrate his freshest mental vigour upon the most important part of
   his narrative; and if any changes be later found needful, they can easily be made. In no part of
   a narrative should a grand or emphatic thought or passage be followed by one of tame or prosaic
   quality. This isanticlimax,and exposes a writer to much ridicule. Notice the absurd
   effect of the following couplet—which was, however, written by no less a person than
   Waller:“Under the
   tropic is our language spoke,And part of Flanders hath receiv’d our
   yoke.”Unity, Mass, CoherenceIn developing a theme, whether descriptive or narrative, it is necessary that
   three structural qualities be present: Unity, Mass, and Coherence. Unity is that principle
   whereby every part of a composition must have some bearing on the central theme. It is the
   principle which excludes all extraneous matter, and demands that all threads converge toward the
   climax. Classical violations of Unity may be found in theepisodesof Homer and other
   epic poets of antiquity, as well as in the digressions of Fielding and other celebrated
   novelists; but no beginner should venture to emulate such liberties. Unity is the quality we
   have lately noted and praised in Poe and Bierce.Mass is that principle which requires the more important parts of a composition to
   occupy correspondingly important places in the whole composition, the paragraph, and the
   sentence. It is that law of taste which insists that emphasis be placed where emphasis is due,
   and is most strikingly embodied in the previously mentioned necessity for an emphatic ending.
   According to this law, the end of a composition is its most important part, with the beginning
   next in importance.Coherence is that principle which groups related parts together and keeps
   unrelated parts removed from one another. It applies, like Mass, to the whole composition, the
   paragraph, or the sentence. It demands that kindred events be narrated without interruption,
   effect following cause in a steady flow.Forms of CompositionFew writers succeed equally in all the various branches of literature. Each type
   of thought has its own particular form of expression, based on natural appropriateness; and the
   average author tends to settle into that form which best fits his particular personality. Many,
   however, follow more than one form; and some writers change from one form to another as
   advancing years produce alterations in their mental processes or points of view.It is well, in the interests of breadth and discipline, for the beginner to
   exercise himself to some degree in every form of literary art. He may thus discover that which
   best fits his mind, and develop hitherto unsuspected potentialities.We have so far surveyed only those simpler phases of writing which centre in prose
   fiction and descriptive essays. Hereafter we hope to touch upon didactic, argumentative, and
   persuasive writing; to investigate to some extent the sources of rhetorical strength and
   elegance; and to consider a few major aspects of versification."
Metrical RegularityBy H. P. Lovecraft by By H. P. Lovecraft,"“Deteriores omnes
sumus licentia.”—Terence.Of the various forms of decadence manifest in the poetical art of the present age, none strikes
more harshly on our sensibilities than the alarming decline in that harmonious regularity of
metre which adorned the poetry of our immediate ancestors.That metre itself forms an essential part of all true poetry is a principle
which not even the assertions of an Aristotle or the pronouncements of a Plato can disestablish.
As old a critic as Dionysius of Halicarnassus and as modern a philosopher as Hegel have each
affirmed that versification in poetry is not alone a necessary attribute, but the very foundation
as well; Hegel, indeed, placing metre above metaphorical imagination as the essence of all poetic
creation.Science can likewise trace the metrical instinct from the very infancy of mankind,
or even beyond, to the pre-human age of the apes. Nature is in itself an unending succession
of regular impulses. The steady recurrence of the seasons and of the moonlight, the coming and
going of the day, the ebb and flow of the tides, the beating of the heart and pulses, the tread
of the feet in walking, and countless other phenomena of like regularity, have all combined
to inculcate in the human brain a rhythmic sense which is as manifest in the most uncultivated,
as in the most polished of peoples. Metre, therefore, is no such false artifice as most exponents
of radicalism would have us believe, but is instead a natural and inevitable embellishment to
poesy, which succeeding ages should develop and refine, rather than maim or destroy.Like other instincts, the metric sense has taken on different aspects among
different races. Savages shew it in its simplest form while dancing to the sound of primitive
drums; barbarians display it in their religious and other chantings; civilised peoples utilise
it for their formal poetry, either as measured quantity, like that of Greek and Roman verse,
or as measured accentual stress, like that of our own English verse. Precision of metre is thus
no mere display of meretricious ornament, but a logical evolution from eminently natural sources.It is the contention of the ultra-modern poet, as enunciated by Mrs. J. W.
Renshaw in her recent article on “The Autocracy of Art” (The Looking Glassfor May), that the truly inspired bard must chant forth his feelings independently of form or
language, permitting each changing impulse to alter the rhythm of his lay, and blindly resigning
his reason to the “fine frenzy” of his mood. This contention is of course founded
upon the assumption that poetry is super-intellectual; the expression of a “soul”
which outranks the mind and its precepts. Now while avoiding the impeachment of this dubious
theory, we must needs remark, that the laws of Nature cannot so easily be outdistanced. However
much true poesy may overtop the produce of the brain, it must still be affected by natural laws,
which are universal and inevitable. Wherefore it is possible for the critic to assume the attitude
of the scientist, and to perceive the various clearly defined natural forms through which the
emotions seek expressions. Indeed, we feel even unconsciously the fitness of certain types of
metre for certain types of thought, and in perusing a crude or irregular poem are often abruptly
repelled by the unwarranted variations made by the bard, either through his ignorance or his
