Title,Text
The Allowable RhymeBy H. P. Lovecraft by By H. P. Lovecraft,"“Sed ubi plura
nitent in carmine, non ego paucisOffendar maculis.”—Horace.The poetical tendency of the present and of the preceding century has been divided in a manner
singularly curious. One loud and conspicuous faction of bards, giving way to the corrupt influences
of a decaying general culture, seems to have abandoned all the proprieties of versification
and reason in its mad scramble after sensational novelty; whilst the other and quieter school,
constituting a more logical evolution from the poesy of the Georgian period, demands an accuracy
of rhyme and metre unknown even to the polished artists of the age of Pope.The rational contemporary disciple of the Nine, justly ignoring the dissonant
shrieks of the radicals, is therefore confronted with a grave choice of technique. May he retain
the liberties of imperfect or “allowable” rhyming which were enjoyed by his ancestors,
or must he conform to the new ideals of perfection evolved during the past century? The writer
of this article is frankly an archaist in verse. He has not scrupled to rhyme “toss’d”
with “coast”, “come” with “Rome”, or “home”
with “gloom” in his very latest published efforts, thereby proclaiming his maintenance
of the old-fashioned poets as models; but sound modern criticism, proceeding from Mr. Rheinhart
Kleiner and from other sources which must needs command respect, has impelled him here to rehearse
the question for public benefit, and particularly to present his own side, attempting to justify
his adherence to the style of two centuries ago.The earliest English attempts at rhyming probably included words whose agreement
is so slight that it deserves the name of mere “assonance” rather than that of actual
rhyme. Thus in the original ballad of “Chevy-Chase”, we encounter “King”
and “within” supposedly rhymed, whilst in the similar “Battle of Otterbourne”
we behold “long” rhymed with “down”, “ground” with “Agurstonne”,
and “name” with “again”. In the ballad of “Sir Patrick Spense”,
“morn” and “storm”, and “deep” and “feet” are
rhymed. But the infelicities were obviously the result not of artistic negligence, but of plebeian
ignorance, since the old ballads were undoubtedly the careless products of a peasant minstrelsy.
In Chaucer, a poet of the Court, the allowable rhyme is but infrequently discovered, hence we
may assume that the original ideal in English verse was the perfect rhyming sound.Spenser uses allowable rhymes, giving in one of his characteristic stanzas
the three distinct sounds of “Lord”, “ador’d”, and “word”,
all supposed to rhyme; but of his pronunciation we know little, and may justly guess that to
the ears of his contemporaries the sounds were not conspicuously different. Ben Jonson’s
employment of imperfect rhyming was much like Spenser’s; moderate, and partially to be
excused on account of a chaotic pronunciation. The better poets of the Restoration were also
sparing of allowable rhymes; Cowley, Waller, Marvell, and many others being quite regular in
this respect.It was therefore upon a world unprepared that Samuel Butler burst forth with
his immortal “Hudibras”, whose comical familiarity of diction is in grotesqueness
surpassed only by its clever licentiousness of rhyming. Butler’s well-known double rhymes
are of necessity forced and inexact, and in ordinary single rhymes he seems to have had no more
regard for precision. “Vow’d” and “would”, “talisman”
and “slain”, “restores” and “devours” are a few specimens
selected at random.Close after Butler came John Oldham, a satirist whose force and brilliancy
gained him universal praise, and whose enormous crudity both in rhyme and in metre was forgotten
amidst the splendour of his attacks. Oldham was almost absolutely ungoverned by the demands
of the ear, and perpetrated such atrocious rhymes as “heads” and “besides”,
“devise” and “this”, “again” and “sin”, “tool”
and “foul”, “end” and “design’d”, and even “prays”
and “cause”.The glorious Dryden, refiner and purifier of English verse, did less for rhyme
than he did for metre. Though nowhere attaining the extravagances of his friend Oldham, he lent
the sanction of his great authority to rhymes which Dr. Johnson admits are “open to objection”.
But one vast difference betwixt Dryden and his loose predecessors must be observed. Dryden had
so far improved metrical cadence, that the final syllables of heroic couplets stood out in especial
eminence, displaying and emphasising every possible similarity of sound; that is, lending to
sounds in the first place approximately similar, the added similarity caused by the new prominence
of their perfectly corresponding positions in their respective lines.It were needless to dwell upon the rhetorical polish of the age immediately
succeeding Dryden’s. So far as English versification is concerned, Pope was the world,
and all the world was Pope. Dryden had founded a new school of verse, but the development and
ultimate perfection of this art remained for the sickly lad who before the age of twelve begged
to be taken to Will’s Coffee-House, that he might obtain one personal view of the aged
Dryden, his idol and model. Delicately attuned to the subtlest harmonies of poetical construction,
Alexander Pope brought English prosody to its zenith, and still stands alone on the heights.
Yet he, exquisite master of verse that he was, frowned not upon imperfect rhymes, provided they
were set in faultless metre. Though most of his allowable rhymes are merely variations in the
breadth and nature of vowel sounds, he in one instance departs far enough from rigid perfection
to rhyme the words “vice” and “destroys”. Yet who can take offence?
The unvarying ebb and flow of the refined metrical impulse conceals and condones all else.Every argument by which English blank verse or Spanish assonant verse is sustained,
may with greater force be applied to the allowable rhyme. Metre is the real essential of poetical
technique, and when two sounds of substantial resemblance are so placed that one follows the
other in a certain measured relation, the normal ear cannot without cavilling find fault with
a slight want of identity in the respective dominant vowels. The rhyming of a long vowel with
a short one is common in all the Georgian poets, and when well recited cannot but be overlooked
amidst the general flow of the verse; as, for instance, the following from Pope:“But thinks, admitted to that equal SKY,His faithful dog shall bear him COMPANY.”Of like nature is the rhyming of actually different vowels whose sounds are, when pronounced
in animated oration, by no means dissimilar. Out of verse, such words as “join”
and “line” are quite unlike, but Pope well rhymes them when he writes:“While expletives their feeble aid do JOIN,And ten low words oft creep in one dull LINE.”It is the final consonantal sound in rhyming which can never vary. This, above
all else, gives the desired similarity. Syllables which agree in vowels but not in final consonants
are not rhymes at all, but simply assonants. Yet such is the inconsistent carelessness of the
average modern writer, that he often uses these mere assonants to a greater extent than his
fathers ever employed actually allowable rhymes. The writer, in his critical duties, has more
than once been forced to point out the attempted rhyming of such words as “fame”
and “lane”, “task” and “glass”, or “feels” and
“yields”, and in view of these impossible combinations he cannot blame himself very
seriously for rhyming “art” and “shot” in the MarchConservative;for this pair of words have at least identical consonants at the end.That allowable rhymes have real advantages of a positive sort is an opinion
by no means lightly to be denied. The monotony of a long heroic poem may often be pleasantly
relieved by judicious interruptions in the perfect succession of rhymes, just as the metre may
sometimes be adorned with occasional triplets and Alexandrines. Another advantage is the greater
latitude allowed for the expression of thought. How numerous are the writers who, from restriction
to perfect rhyming, are frequently compelled to abandon a neat epigram or brilliant antithesis,
which allowable rhyme would easily permit, or else to introduce a dull expletive merely to supply
a desired rhyme!But a return to historical considerations shews us only too clearly the logical
trend of taste, and the reason Mr. Kleiner’s demand for absolute perfection is no idle
cry. In Oliver Goldsmith there arose one who, though retaining the familiar classical diction
of Pope, yet advanced further still toward what he deemed ideal polish by virtually abandoning
the allowable rhyme. In unvaried exactitude run the couplets of “The Traveller”
and of “The Deserted Village”, and none can deny to them a certain urbanity which
pleases the critical ear. With but little less precision are moulded the simple rhymes of Cowper,
whilst the pompous Erasmus Darwin likewise shews more attention to identity of sound than do
the Queen Anne bards. Gifford’s translations of Juvenal and Persius shew to an almost
equal degree the tendency of the age, and Campbell, Crabbe, Wordsworth, Byron, Keats, and Thomas
Moore are all inclined to refrain from the liberties practiced by those of former times. To
deny the importance of such a widespread change of technique is fruitless, for its existence
argues for its naturalness. The best critics of the nineteenth and twentieth centuries demand
perfect rhyming, and no aspirant for fame can afford to depart from a standard so universal.
It is evidently the true goal of the English, as well as of the French bard; the goal from which
we were but temporarily deflected during the preceding age.But exceptions should and must be made in the case of a few who have somehow
absorbed the atmosphere of other days, and who long in their hearts for the stately sound of
the old classic cadences. Well may their predilection for imperfect rhyming be discouraged to
a limited extent, but to chain them wholly to modern rules would be barbarous. Every individual
mind demands a certain freedom of expression, and the man who cannot express himself satisfactorily
without the stimulation derived from the spirited mode of two centuries ago should certainly
be permitted to follow without undue restraint a practice at once so harmless, so free from
essential error, and so sanctioned by precedent, as that of employing in his poetical compositions
the smooth and inoffensive allowable rhyme."
At the RootBy H. P. Lovecraft by By H. P. Lovecraft,"To those who look beneath the surface, the present universal war drives home more than one anthropological
truth in striking fashion; and of these verities none is more profound than that relating to
the essential immutability of mankind and its instincts.Four years ago a large part of the civilised world laboured under certain biological
fallacies which may, in a sense, be held responsible for the extent and duration of the present
conflict. These fallacies, which were the foundation of pacifism and other pernicious forms
of social and political radicalism, dealt with the capability of man to evolve mentally beyond
his former state of subservience to primitive instinct and pugnacity, and to conduct his affairs
and international or inter-racial relations on a basis of reason and good-will. That belief
in such capability is unscientific and childishly naive, is beside the question. The fact remains,
that the most civilised part of the world, including our own Anglo-Saxondom, did entertain enough
of these notions to relax military vigilance, lay stress on points of honour, place trust in
treaties, and permit a powerful and unscrupulous nation to indulge unchecked and unsuspected
in nearly fifty years of preparation for world-wide robbery and slaughter. We are reaping the
result of our simplicity.The past is over. Our former follies we can but regret, and expiate as best
we may by a crusade to the death against the Trans-Rhenane monster which we allowed to grow
and flourish beneath our very eyes. But the future holds more of responsibility, and we must
prepare to guard against any renascence of the benevolent delusions that four years of blood
have barely been able to dispel. In a word, we must learn to discard forever the sentimental
standpoint, and to view our species through the cold eyes of science alone. We must recognise
the essential underlying savagery in the animal called man, and return to older and sounder
principles of national life and defence. We must realise that man’s nature will remain
the same so long as he remains man; that civilisation is but a slight coverlet beneath which
the dominant beast sleeps lightly and ever ready to awake. To preserve civilisation, we must
deal scientifically with the brute element, using only genuine biological principles. In considering
ourselves, we think too much of ethics and sociology—too little of plain natural history.
We should perceive that man’s period of historical existence, a period so short that his
physical constitution has not been altered in the slightest degree, is insufficient to allow
of any considerable mental change. The instincts that governed the Egyptians and the Assyrians
of old, govern us as well; and as the ancients thought, grasped, struggled, and deceived, so
shall we moderns continue to think, grasp, struggle, and deceive in our inmost hearts. Change
is only superficial and apparent.Man’s respect for the imponderables varies according to his mental constitution
and environment. Through certain modes of thought and training it can be elevated tremendously,
yet there is always a limit. The man or nation of high culture may acknowledge to great lengths
the restraints imposed by conventions and honour, but beyond a certain point primitive will
or desire cannot be curbed. Denied anything ardently desired, the individual or state will argue
and parley just so long—then, if the impelling motive be sufficiently great, will cast
aside every rule and break down every acquired inhibition, plunging viciously after the object
wished; all the more fantastically savage because of previous repression.The sole ultimate
factor in human decisions is physical force.This we must learn, however repugnant the idea
may seem, if we are to protect ourselves and our institutions. Reliance on anything else is
fallacious and ruinous. Dangerous beyond description are the voices sometimes heard today, decrying
the continuance of armament after the close of the present hostilities.The specific application of the scientific truth regarding man’s native
instincts will be found in the adoption of a post-bellum international programme. Obviously,
we must take into account the primordial sub-structure and arrange for the upholding of culture
by methods which will stand the acid test of stress and conflicting ambitions. In disillusioned
diplomacy, ample armament, and universal training alone will be found the solution of the world’s
difficulties. It will not be a perfect solution, because humanity is not perfect. It will not
abolish war, because war is the expression of a natural human tendency. But it will at least
produce an approximate stability of social and political conditions, and prevent the menace
of the entire world by the greed of any one of its constituent parts."
Cats and DogsBy H. P. Lovecraft by By H. P. Lovecraft,"Being told of the cat-and-dog fight about to occur in the Blue Pencil Club—a
new thing for your circle, perhaps, though not unfamiliar to amateurdom as a whole—I cannot
resist contributing a few Thomasic yowls and sibilants upon my side of the dispute, though conscious
that the word of a venerable ex-member can scarcely have much weight against the brilliancy
of such still active adherents as may bark upon the other side. Aware of my ineptitude at argument,
my valued correspondent Curator James Ferdinand Morton of Paterson has sent me the records of
a similar controversy in theNew York Tribune,in which Mr. Carl Van Doren is on my side
and Mr. Albert Payson Terhune on that of the canine tribe. From this I would be glad to plagiarise
such data as I need; but Mr. Morton, with genuinely Machiavellian subtlety, has furnished me
with only a part of the feline section whilst submitting the doggish brief in full. No doubt
he imagines that this arrangement, in view of my own emphatic bias, makes for something like
ultimate fairness; but for me it is exceedingly inconvenient, since it will force me to be more
or less original in several parts of the ensuing remarks.Between dogs and cats my degree of choice is so great that it would never occur
to me to compare the two. I have no active dislike for dogs, any more than I have for monkeys,
human beings, negroes, cows, sheep, or pterodactyls; but for the cat I have entertained a particular
respect and affection ever since the earliest days of my infancy. In its flawless grace and
superior self-sufficiency I have seen a symbol of the perfect beauty and bland impersonality
of the universe itself, objectively considered; and in its air of silent mystery there resides
for me all the wonder and fascination of the unknown. The dog appeals to cheap and facile emotions;
the cat to the deepest founts of imagination and cosmic perception in the human mind. It is
no accident that the contemplative Egyptians, together with such later poetic spirits as Poe,
Gautier, Baudelaire, and Swinburne, were all sincere worshippers of the supple grimalkin.Naturally, one’s preference in the matter of cats and dogs depends wholly
upon one’s temperament and point of view. The dog would appear to me to be the favourite
of superficial, sentimental, emotional, and democratic people—people who feel rather than
think, who attach importance to mankind and the popular conventional emotions of the simple,
and who find their greatest consolation in the fawning and dependent attachments of a gregarious
society. Such people live in a limited world of imagination; accepting uncritically the values
of common folklore, and always preferring to have their naive beliefs, feelings, and prejudices
tickled, rather than to enjoy a purely aesthetic and philosophic pleasure arising from discrimination,
contemplation, and the recognition of austere absolute beauty. This is not to say that the cheaper
emotions do not also reside in the average cat-lover’s love of cats, but merely to point
out that in ailurophily there exists a basis of true aestheticism which kynophily does not possess.
The real lover of cats is one who demands a clearer adjustment to the universe than ordinary
household platitudes provide; one who refuses to swallow the sentimental notion that all good
people love dogs, children, and horses while all bad people dislike and are disliked by such.
He is unwilling to set up himself and his cruder feelings as a measure of universal values,
or to allow shallow ethical notions to warp his judgment. In a word, he had rather admire and
respect than effuse and dote; and does not fall into the fallacy that pointless sociability
and friendliness, or slavering devotion and obedience, constitute anything intrinsically admirable
or exalted. Dog-lovers base their whole case on these commonplace, servile, and plebeian qualities,
and amusingly judge the intelligence of a pet by its degree of conformity to their own wishes.
Catlovers escape this delusion, repudiate the idea that cringing subservience and sidling companionship
to man are supreme merits, and stand free to worship aristocratic independence, self-respect,
and individual personality joined to extreme grace and beauty as typified by the cool, lithe,
cynical, and unconquered lord of the housetops.Persons of commonplace ideas—unimaginative worthy burghers who are satisfied
with the daily round of things and who subscribe to the popular credo of sentimental values—will
always be dog-lovers. To them nothing will ever be more important than themselves and their
own more primitive feelings, and they will never cease to esteem and glorify the fellow-animal
who best typifies these. Such persons are submerged in the vortex of Oriental idealism and abasement
which ruined classic civilisation in the Dark Ages, and live in a bleak world of abstract sentimental
values wherein the mawkish illusions of meekness, devotion, gentleness, brotherhood, and whining
humility are magnified into supreme virtues, and a whole false ethic and philosophy erected
on the timid reactions of the flexor system of muscles. This heritage, ironically foisted on
us when Roman politics raised the faith of a whipped and broken people to supremacy in the later
empire, has naturally kept a strong hold over the weak and the sentimentally thoughtless; and
perhaps reached its culmination in the insipid nineteenth century, when people were wont to
praise dogs “because they are so human” (as if humanity were any valid standard
of merit!), and honest Edwin Landseer painted hundreds of smug Fidoes and Carlos and Rovers
with all the anthropoid triviality, pettiness, and “cuteness” of eminent Victorians.But amidst this chaos of intellectual and emotional grovelling a few free souls
have always stood out for the old civilised realities which mediaevalism eclipsed—the
stern classic loyalty to truth, strength, and beauty given by a clear mind and uncowed spirit
to the full-living Western Aryan confronted by Nature’s majesty, loveliness, and aloofness.
This is the virile aesthetic and ethic of the extensor muscles—the bold, buoyant, assertive
beliefs and preferences of proud, dominant, unbroken, and unterrified conquerors, hunters, and
warriors—and it has small use for the shams and whimperings of the brotherly, affection-slobbering
peacemaker and cringer and sentimentalist. Beauty and sufficiency—twin qualities of the
cosmos itself—are the gods of this aristocratic and pagan type; to the worshipper of such
eternal things the supreme virtue will not be found in lowliness, attachment, obedience, and
emotional messiness. This sort of worshipper will look for that which best embodies the loveliness
of the stars and the worlds and the forests and the seas and the sunsets, and which best acts
out the blandness, lordliness, accuracy, self-sufficiency, cruelty, independence, and contemptuous
and capricious impersonality of all-governing Nature. Beauty—coolness—aloofness—philosophic
repose—self-sufficiency—untamed mastery—where else can we find these things
incarnated with even half the perfection and completeness that mark their incarnation in the
peerless and softly gliding cat, which performs its mysterious orbit with the relentless and
unobtrusive certainty of a planet in infinity?That dogs are dear to the unimaginative peasant-burgher whilst cats appeal
to the sensitive poet-aristocrat-philosopher will be clear in a moment when we reflect on the
matter of biological association. Practical plebeian folk judge a thing only by its immediate
touch, taste, and smell; while more delicate types form their estimates from the linked images
and ideas which the object calls up in their minds. Now when dogs and cats are considered, the
stolid churl sees only the two animals before him, and bases his favour on their relative capacity
to pander to his sloppy, unformed ideas of ethics and friendship and flattering subservience.
On the other hand the gentleman and thinker sees each in all its natural affiliations, and cannot
fail to notice that in the great symmetries of organic life dogs fall in with slovenly wolves
and foxes and jackals and coyotes and dingoes and painted hyaenas, whilst cats walk proudly
with the jungle’s lords, and own the haughty lion, the sinuous leopard, the regal tiger,
and the shapely panther and jaguar as their kin. Dogs are the hieroglyphs of blind emotion,
inferiority, servile attachment, and gregariousness—the attributes of commonplace, stupidly
passionate, and intellectually and imaginatively undeveloped men. Cats are the runes of beauty,
invincibility, wonder, pride, freedom, coldness, self-sufficiency, and dainty individuality—the
qualities of sensitive, enlightened, mentally developed, pagan, cynical, poetic, philosophic,
dispassionate, reserved, independent, Nietzschean, unbroken, civilised, master-class men. The
dog is a peasant and the cat is a gentleman.We may, indeed, judge the tone and bias of a civilisation by its relative attitude
toward dogs and cats. The proud Egypt wherein Pharaoh was Pharaoh and pyramids rose in beauty
at the wish of him who dreamed them bowed down to the cat, and temples were builded to its goddess
at Bubastis. In imperial Rome the graceful leopard adorned most homes of quality, lounging in
insolent beauty in the atrium with golden collar and chain; while after the age of the Antonines
the actual cat was imported from Egypt and cherished as a rare and costly luxury. So much for
dominant and enlightened peoples. When, however, we come to the grovelling Middle Ages with
their superstitions and ecstasies and monasticisms and maunderings over saints and their relics,
we find the cool and impersonal loveliness of the felidae in very low esteem; and behold a sorry
spectacle of hatred and cruelty shewn toward the beautiful little creature whose mousing virtues
alone gained it sufferance amongst the ignorant churls who resented its self-respecting coolness
and feared its cryptical and elusive independence as something akin to the dark powers of witchcraft.
These boorish slaves of eastern darkness could not tolerate what did not serve their own cheap
