Title,Text
loveliness. “Lying on the floor was a dead man, in evening dress, with a knife in his
heart. He was withered, wrinkled, and loathsome of visage. It was not till they had examined
the rings that they recognised who it was.”Matthew Phipps Shiel, author of many weird, grotesque, and adventurous novels
and tales, occasionally attains a high level of horrific magic. “Xélucha”
is a noxiously hideous fragment, but is excelled by Mr. Shiel’s undoubted masterpiece,
“The House of Sounds”, floridly written in the “yellow ’nineties”,
and re-cast with more artistic restraint in the early twentieth century. This story, in final
form, deserves a place among the foremost things of its kind. It tells of a creeping horror
and menace trickling down the centuries on a sub-arctic island off the coast of Norway; where,
amidst the sweep of daemon winds and the ceaseless din of hellish waves and cataracts, a vengeful
dead man built a brazen tower of terror. It is vaguely like, yet infinitely unlike, Poe’s
“Fall of the House of Usher”. In the novelThe Purple CloudMr. Shiel describes
with tremendous power a curse which came out of the arctic to destroy mankind, and which for
a time appears to have left but a single inhabitant on our planet. The sensations of this lone
survivor as he realises his position, and roams through the corpse-littered and treasure-strown
cities of the world as their absolute master, are delivered with a skill and artistry falling
little short of actual majesty. Unfortunately the second half of the book, with its conventionally
romantic element, involves a distinct “letdown”.Better known than Shiel is the ingenious Bram Stoker, who created many starkly
horrific conceptions in a series of novels whose poor technique sadly impairs their net effect.The Lair of the White Worm,dealing with a gigantic primitive entity that lurks in a
vault beneath an ancient castle, utterly ruins a magnificent idea by a development almost infantile.The Jewel of Seven Stars,touching on a strange Egyptian resurrection, is less crudely
written. But best of all is the famousDracula,which has become almost the standard
modern exploitation of the frightful vampire myth. Count Dracula, a vampire, dwells in a horrible
castle in the Carpathians; but finally migrates to England with the design of populating the
country with fellow vampires. How an Englishman fares within Dracula’s stronghold of terrors,
and how the dead fiend’s plot for domination is at last defeated, are elements which unite
to form a tale now justly assigned a permanent place in English letters.Draculaevoked
many similar novels of supernatural horror, among which the best are perhapsThe Beetle,by Richard Marsh,Brood of the Witch-Queen,by “Sax Rohmer” (Arthur Sarsfield
Ward), andThe Door of the Unreal,by Gerald Biss. The latter handles quite dexterously
the standard werewolf superstition. Much subtler and more artistic, and told with singular skill
through the juxtaposed narratives of the several characters, is the novelCold Harbour,by Francis Brett Young, in which an ancient house of strange malignancy is powerfully delineated.
The mocking and well-nigh omnipotent fiend Humphrey Furnival holds echoes of the Manfred-Montoni
type of early Gothic “villain”, but is redeemed from triteness by many clever individualities.
Only the slight diffuseness of explanation at the close, and the somewhat too free use of divination
as a plot factor, keep this tale from approaching absolute perfection.In the novelWitch WoodJohn Buchan depicts with tremendous force a
survival of the evil Sabbat in a lonely district of Scotland. The description of the black forest
with the evil stone, and of the terrible cosmic adumbrations when the horror is finally extirpated,
will repay one for wading through the very gradual action and plethora of Scottish dialect.
Some of Mr. Buchan’s short stories are also extremely vivid in their spectral intimations;
“The Green Wildebeest”, a tale of African witchcraft, “The Wind in the Portico”,
with its awakening of dead Britanno-Roman horrors, and “Skule Skerry”, with its
touches of sub-arctic fright, being especially remarkable.Clemence Housman, in the brief novelette “The Were-wolf”, attains
a high degree of gruesome tension and achieves to some extent the atmosphere of authentic folklore.
InThe Elixir of LifeArthur Ransome attains some darkly excellent effects despite a
general naiveté of plot, while H. B. Drake’sThe Shadowy Thingsummons up
strange and terrible vistas. George Macdonald’sLilithhas a compelling bizarrerie
all its own; the first and simpler of the two versions being perhaps the more effective.Deserving of distinguished notice as a forceful craftsman to whom an unseen
mystic world is ever a close and vital reality is the poet Walter de la Mare, whose haunting
verse and exquisite prose alike bear consistent traces of a strange vision reaching deeply into
veiled spheres of beauty and terrible and forbidden dimensions of being. In the novelThe
Returnwe see the soul of a dead man reach out of its grave of two centuries and fasten
itself upon the flesh of the living, so that even the face of the victim becomes that which
had long ago returned to dust. Of the shorter tales, of which several volumes exist, many are
unforgettable for their command of fear’s and sorcery’s darkest ramifications; notably
“Seaton’s Aunt”, in which there lowers a noxious background of malignant vampirism;
“The Tree”, which tells of a frightful vegetable growth in the yard of a starving
artist; “Out of the Deep”, wherein we are given leave to imagine what thing answered
the summons of a dying wastrel in a dark lonely house when he pulled a long-feared bell-cord
in the attic chamber of his dread-haunted boyhood; “A Recluse”, which hints at
what sent a chance guest flying from a house in the night; “Mr. Kempe”, which shews
us a mad clerical hermit in quest of the human soul, dwelling in a frightful sea-cliff region
beside an archaic abandoned chapel; and “All-Hallows”, a glimpse of daemoniac forces
besieging a lonely mediaeval church and miraculously restoring the rotting masonry. De la Mare
does not make fear the sole or even the dominant element of most of his tales, being apparently
more interested in the subtleties of character involved. Occasionally he sinks to sheer whimsical
phantasy of the Barrie order. Still, he is among the very few to whom unreality is a vivid,
living presence; and as such he is able to put into his occasional fear-studies a keen potency
which only a rare master can achieve. His poem “The Listeners” restores the Gothic
shudder to modern verse.The weird short story has fared well of late, an important contributor being
the versatile E. F. Benson, whose “The Man Who Went Too Far” breathes whisperingly
of a house at the edge of a dark wood, and of Pan’s hoof-mark on the breast of a dead
man. Mr. Benson’s volume,Visible and Invisible,contains several stories of singular
power; notably“Negotium Perambulans”,whose unfolding reveals an abnormal
monster from an ancient ecclesiastical panel which performs an act of miraculous vengeance in
a lonely village on the Cornish coast, and “The Horror-Horn”, through which lopes
a terrible half-human survival dwelling on unvisited Alpine peaks. “The Face”,
in another collection, is lethally potent in its relentless aura of doom. H. R. Wakefield, in
his collectionsThey Return at EveningandOthers Who Return,manages now and
then to achieve great heights of horror despite a vitiating air of sophistication. The most
notable stories are “The Red Lodge” with its slimy aqueous evil, “‘He
Cometh and He Passeth By’”, “‘And He Shall Sing . . .’”,
“The Cairn”, “‘Look Up There!’”, “Blind Man’s
Buff”, and that bit of lurking millennial horror, “The Seventeenth Hole at Duncaster”.
Mention has been made of the weird work of H. G. Wells and A. Conan Doyle. The former, in “The
Ghost of Fear”, reaches a very high level; while all the items inThirty Strange Storieshave strong fantastic implications. Doyle now and then struck a powerfully spectral note, as
in “The Captain of the ‘Pole-Star’”, a tale of arctic ghostliness,
and “Lot No. 249”, wherein the reanimated mummy theme is used with more than ordinary
skill. Hugh Walpole, of the same family as the founder of Gothic fiction, has sometimes approached
the bizarre with much success; his short story “Mrs. Lunt” carrying a very poignant
shudder. John Metcalfe, in the collection published asThe Smoking Leg,attains now
and then a rare pitch of potency; the tale entitled “The Bad Lands” containing graduations
of horror that strongly savour of genius. More whimsical and inclined toward the amiable and
innocuous phantasy of Sir J. M. Barrie are the short tales of E. M. Forster, grouped under the
title ofThe Celestial Omnibus.Of these only one, dealing with a glimpse of Pan and
his aura of fright, may be said to hold the true element of cosmic horror. Mrs. H. D. Everett,
though adhering to very old and conventional models, occasionally reaches singular heights of
spiritual terror in her collection of short stories. L. P. Hartley is notable for his incisive
and extremely ghastly tale, “A Visitor from Down Under”. May Sinclair’sUncanny Storiescontain more of traditional occultism than of that creative treatment of
fear which marks mastery in this field, and are inclined to lay more stress on human emotions
and psychological delving than upon the stark phenomena of a cosmos utterly unreal. It may be
well to remark here that occult believers are probably less effective than materialists in delineating
the spectral and the fantastic, since to them the phantom world is so commonplace a reality
that they tend to refer to it with less awe, remoteness, and impressiveness than do those who
see in it an absolute and stupendous violation of the natural order.Of rather uneven stylistic quality, but vast occasional power in its suggestion
of lurking worlds and beings behind the ordinary surface of life, is the work of William Hope
Hodgson, known today far less than it deserves to be. Despite a tendency toward conventionally
sentimental conceptions of the universe, and of man’s relation to it and to his fellows,
Mr. Hodgson is perhaps second only to Algernon Blackwood in his serious treatment of unreality.
Few can equal him in adumbrating the nearness of nameless forces and monstrous besieging entities
through casual hints and insignificant details, or in conveying feelings of the spectral and
the abnormal in connexion with regions or buildings.InThe Boats of the “Glen Carrig”(1907) we are shewn a
variety of malign marvels and accursed unknown lands as encountered by the survivors of a sunken
ship. The brooding menace in the earlier parts of the book is impossible to surpass, though
a letdown in the direction of ordinary romance and adventure occurs toward the end. An inaccurate
and pseudo-romantic attempt to reproduce eighteenth-century prose detracts from the general
effect, but the really profound nautical erudition everywhere displayed is a compensating factor.The House on the Borderland(1908)—perhaps the greatest of all
Mr. Hodgson’s works—tells of a lonely and evilly regarded house in Ireland which
forms a focus for hideous other-world forces and sustains a siege by blasphemous hybrid anomalies
from a hidden abyss below. The wanderings of the narrator’s spirit through limitless light-years
of cosmic space and kalpas of eternity, and its witnessing of the solar system’s final
destruction, constitute something almost unique in standard literature. And everywhere there
is manifest the author’s power to suggest vague, ambushed horrors in natural scenery.
But for a few touches of commonplace sentimentality this book would be a classic of the first
water.The Ghost Pirates(1909), regarded by Mr. Hodgson as rounding out a
trilogy with the two previously mentioned works, is a powerful account of a doomed and haunted
ship on its last voyage, and of the terrible sea-devils (of quasi-human aspect, and perhaps
the spirits of bygone buccaneers) that besiege it and finally drag it down to an unknown fate.
With its command of maritime knowledge, and its clever selection of hints and incidents suggestive
of latent horrors in Nature, this book at times reaches enviable peaks of power.The Night Land(1912) is a long-extended (583 pp.) tale of the earth’s
infinitely remote future—billions of billions of years ahead, after the death of the sun.
It is told in a rather clumsy fashion, as the dreams of a man in the seventeenth century, whose
mind merges with its own future incarnation; and is seriously marred by painful verboseness,
repetitiousness, artificial and nauseously sticky romantic sentimentality, and an attempt at
archaic language even more grotesque and absurd than that in“Glen Carrig”.Allowing for all its faults, it is yet one of the most potent pieces of macabre
imagination ever written. The picture of a night-black, dead planet, with the remains of the
human race concentrated in a stupendously vast metal pyramid and besieged by monstrous, hybrid,
and altogether unknown forces of the darkness, is something that no reader can ever forget.
Shapes and entities of an altogether non-human and inconceivable sort—the prowlers of
the black, man-forsaken, and unexplored world outside the pyramid—aresuggestedandpartlydescribed with ineffable potency; while the night-bound landscape with its
chasms and slopes and dying volcanism takes on an almost sentient terror beneath the author’s
touch.Midway in the book the central figure ventures outside the pyramid on a quest
through death-haunted realms untrod by man for millions of years—and in his slow, minutely
described, day-by-day progress over unthinkable leagues of immemorial blackness there is a sense
of cosmic alienage, breathless mystery, and terrified expectancy unrivalled in the whole range
of literature. The last quarter of the book drags woefully, but fails to spoil the tremendous
power of the whole.Mr. Hodgson’s later volume,Carnacki, the Ghost-Finder,consists
of several longish short stories published many years before in magazines. In quality it falls
conspicuously below the level of the other books. We here find a more or less conventional stock
figure of the “infallible detective” type—the progeny of M. Dupin and Sherlock
Holmes, and the close kin of Algernon Blackwood’s John Silence—moving through scenes
and events badly marred by an atmosphere of professional “occultism”. A few of the
episodes, however, are of undeniable power; and afford glimpses of the peculiar genius characteristic
of the author.Naturally it is impossible in a brief sketch to trace out all the classic modern
uses of the terror element. The ingredient must of necessity enter into all work both prose
and verse treating broadly of life; and we are therefore not surprised to find a share in such
writers as the poet Browning, whose “Childe Roland to the Dark Tower Came” is instinct
with hideous menace, or the novelist Joseph Conrad, who often wrote of the dark secrets within
the sea, and of the daemoniac driving power of Fate as influencing the lives of lonely and maniacally
resolute men. Its trail is one of infinite ramifications; but we must here confine ourselves
to its appearance in a relatively unmixed state, where it determines and dominates the work
of art containing it.Somewhat separate from the main British stream is that current of weirdness
in Irish literature which came to the fore in the Celtic Renaissance of the later nineteenth
and early twentieth centuries. Ghost and fairy lore have always been of great prominence in
Ireland, and for over an hundred years have been recorded by a line of such faithful transcribers
and translators as William Carleton, T. Crofton Croker, Lady Wilde—mother of Oscar Wilde—Douglas
Hyde, and W. B. Yeats. Brought to notice by the modern movement, this body of myth has been
carefully collected and studied; and its salient features reproduced in the work of later figures
like Yeats, J. M. Synge, “A. E.”, Lady Gregory, Padraic Colum, James Stephens, and
their colleagues.Whilst on the whole more whimsically fantastic than terrible, such folklore
and its consciously artistic counterparts contain much that falls truly within the domain of
cosmic horror. Tales of burials in sunken churches beneath haunted lakes, accounts of death-heralding
banshees and sinister changelings, ballads of spectres and “the unholy creatures of the
raths”—all these have their poignant and definite shivers, and mark a strong and
distinctive element in weird literature. Despite homely grotesqueness and absolute naiveté,
there is genuine nightmare in the class of narrative represented by the yarn of Teig O’Kane,
who in punishment for his wild life was ridden all night by a hideous corpse that demanded burial
and drove him from churchyard to churchyard as the dead rose up loathsomely in each one and
refused to accommodate the newcomer with a berth. Yeats, undoubtedly the greatest figure of
the Irish revival if not the greatest of all living poets, has accomplished notable things both
in original work and in the codification of old legends.X. The Modern MastersThe best horror-tales of today, profiting by the long evolution of the type,
possess a naturalness, convincingness, artistic smoothness, and skilful intensity of appeal
quite beyond comparison with anything in the Gothic work of a century or more ago. Technique,
craftsmanship, experience, and psychological knowledge have advanced tremendously with the passing
years, so that much of the older work seems naive and artificial; redeemed, when redeemed at
all, only by a genius which conquers heavy limitations. The tone of jaunty and inflated romance,
full of false motivation and investing every conceivable event with a counterfeit significance
and carelessly inclusive glamour, is now confined to lighter and more whimsical phases of supernatural
writing. Serious weird stories are either made realistically intense by close consistency and
perfect fidelity to Nature except in the one supernatural direction which the author allows
himself, or else cast altogether in the realm of phantasy, with atmosphere cunningly adapted
to the visualisation of a delicately exotic world of unreality beyond space and time, in which
almost anything may happen if it but happen in true accord with certain types of imagination
and illusion normal to the sensitive human brain. This, at least, is the dominant tendency;
though of course many great contemporary writers slip occasionally into some of the flashy postures
of immature romanticism, or into bits of the equally empty and absurd jargon of pseudo-scientific
“occultism”, now at one of its periodic high tides.Of living creators of cosmic fear raised to its most artistic pitch, few if
any can hope to equal the versatile Arthur Machen; author of some dozen tales long and short,
in which the elements of hidden horror and brooding fright attain an almost incomparable substance
and realistic acuteness. Mr. Machen, a general man of letters and master of an exquisitely lyrical
and expressive prose style, has perhaps put more conscious effort into his picaresqueChronicle
of Clemendy,his refreshing essays, his vivid autobiographical volumes, his fresh and spirited
translations, and above all his memorable epic of the sensitive aesthetic mind,The Hill
of Dreams,in which the youthful hero responds to the magic of that ancient Welsh environment
which is the author’s own, and lives a dream-life in the Roman city of Isca Silurum, now
shrunk to the relic-strown village of Caerleon-on-Usk. But the fact remains that his powerful
horror-material of the ’nineties and earlier nineteen-hundreds stands alone in its class,
and marks a distinct epoch in the history of this literary form.Mr. Machen, with an impressionable Celtic heritage linked to keen youthful
memories of the wild domed hills, archaic forests, and cryptical Roman ruins of the Gwent countryside,
has developed an imaginative life of rare beauty, intensity, and historic background. He has
absorbed the mediaeval mystery of dark woods and ancient customs, and is a champion of the Middle
Ages in all things—including the Catholic faith. He has yielded, likewise, to the spell
of the Britanno-Roman life which once surged over his native region; and finds strange magic
in the fortified camps, tessellated pavements, fragments of statues, and kindred things which
tell of the day when classicism reigned and Latin was the language of the country. A young American
poet, Frank Belknap Long, Jun., has well summarised this dreamer’s rich endowments and
wizardry of expression in the sonnet “On Reading Arthur Machen”:“There is a glory in the autumn wood;The ancient lanes of England wind and climbPast wizard oaks and gorse and tangled thymeTo where a fort of mighty empire stood:There is a glamour in the autumn sky;The reddened clouds are writhing in the glowOf some great fire, and there are glints belowOf tawny yellow where the embers die.I wait, for he will show me, clear and cold,High-rais’d in splendour, sharp against the North,The Roman eagles, and thro’ mists of goldThe marching legions as they issue forth:I wait, for I would share with him againThe ancient wisdom, and the ancient pain.”Of Mr. Machen’s horror-tales the most famous is perhaps “The Great
God Pan” (1894), which tells of a singular and terrible experiment and its consequences.
A young woman, through surgery of the brain-cells, is made to see the vast and monstrous deity
of Nature, and becomes an idiot in consequence, dying less than a year later. Years afterward
a strange, ominous, and foreign-looking child named Helen Vaughan is placed to board with a
family in rural Wales, and haunts the woods in unaccountable fashion. A little boy is thrown
out of his mind at sight of someone or something he spies with her, and a young girl comes to
a terrible end in similar fashion. All this mystery is strangely interwoven with the Roman rural
deities of the place, as sculptured in antique fragments. After another lapse of years, a woman
of strangely exotic beauty appears in society, drives her husband to horror and death, causes
an artist to paint unthinkable paintings of Witches’ Sabbaths, creates an epidemic of
suicide among the men of her acquaintance, and is finally discovered to be a frequenter of the
lowest dens of vice in London, where even the most callous degenerates are shocked at her enormities.
Through the clever comparing of notes on the part of those who have had word of her at various
stages of her career, this woman is discovered to be the girl Helen Vaughan; who is the child—by
no mortal father—of the young woman on whom the brain experiment was made. She is a daughter
of hideous Pan himself, and at the last is put to death amidst horrible transmutations of form
involving changes of sex and a descent to the most primal manifestations of the life-principle.But the charm of the tale is in the telling. No one could begin to describe
the cumulative suspense and ultimate horror with which every paragraph abounds without following
fully the precise order in which Mr. Machen unfolds his gradual hints and revelations. Melodrama
is undeniably present, and coincidence is stretched to a length which appears absurd upon analysis;
but in the malign witchery of the tale as a whole these trifles are forgotten, and the sensitive
reader reaches the end with only an appreciative shudder and a tendency to repeat the words
of one of the characters: “It is too incredible, too monstrous; such things can never
be in this quiet world. . . . Why, man, if such a case were possible, our earth would be a nightmare.”Less famous and less complex in plot than “The Great God Pan”,
but definitely finer in atmosphere and general artistic value, is the curious and dimly disquieting
chronicle called “The White People”, whose central portion purports to be the diary
or notes of a little girl whose nurse has introduced her to some of the forbidden magic and
soul-blasting traditions of the noxious witch-cult—the cult whose whispered lore was handed
down long lines of peasantry throughout Western Europe, and whose members sometimes stole forth
at night, one by one, to meet in black woods and lonely places for the revolting orgies of the
Witches’ Sabbath. Mr. Machen’s narrative, a triumph of skilful selectiveness and
restraint, accumulates enormous power as it flows on in a stream of innocent childish prattle;
introducing allusions to strange “nymphs”, “Dôls”, “voolas”,
“White, Green, and Scarlet Ceremonies”, “Aklo letters”, “Chian
language”, “Mao games”, and the like. The rites learned by the nurse from
her witch grandmother are taught to the child by the time she is three years old, and her artless
accounts of the dangerous secret revelations possess a lurking terror generously mixed with
pathos. Evil charms well known to anthropologists are described with juvenile naiveté,
and finally there comes a winter afternoon journey into the old Welsh hills, performed under
an imaginative spell which lends to the wild scenery an added weirdness, strangeness, and suggestion
of grotesque sentience. The details of this journey are given with marvellous vividness, and
form to the keen critic a masterpiece of fantastic writing, with almost unlimited power in the
intimation of potent hideousness and cosmic aberration. At length the child—whose age
is then thirteen—comes upon a cryptic and banefully beautiful thing in the midst of a
